#UC5

mysql> SELECT * FROM addressbook;
+-----------+----------+---------------+----------+---------------+--------+-------------+--------------------+
| firstname | lastname | address       | city     | state         | zip    | phonenumber | email              |
+-----------+----------+---------------+----------+---------------+--------+-------------+--------------------+
| Mangesh   | Labade   | Shivaji Nagar | Amravati | Maharashtra   | 456123 | 7894561230  | rahul@gmail.com    |
| Altamsh   | Bagwan   | Arjun Nagar   | Satara   | Maharashtra   | 456123 | 98765463112 | altamash@gmail.com |
| Salman    | Pasha    | Shyam Nagar   | Bangluru | Karnataka     | 654789 | 8529637410  | salman@gmail.com   |
| Shailesh  | Dubey    | Bhuj nagar    | Patna    | Uttar Pradesh | 753951 | 9510423678  | shailesh@gmail.com |
+-----------+----------+---------------+----------+---------------+--------+-------------+--------------------+
4 rows in set (0.04 sec)

mysql> DELETE FROM addressbook WHERE firstname ='Salman';
Query OK, 1 row affected (0.12 sec)

mysql> SELECT * FROM addressbook;
+-----------+----------+---------------+----------+---------------+--------+-------------+--------------------+
| firstname | lastname | address       | city     | state         | zip    | phonenumber | email              |
+-----------+----------+---------------+----------+---------------+--------+-------------+--------------------+
| Mangesh   | Labade   | Shivaji Nagar | Amravati | Maharashtra   | 456123 | 7894561230  | rahul@gmail.com    |
| Altamsh   | Bagwan   | Arjun Nagar   | Satara   | Maharashtra   | 456123 | 98765463112 | altamash@gmail.com |
| Shailesh  | Dubey    | Bhuj nagar    | Patna    | Uttar Pradesh | 753951 | 9510423678  | shailesh@gmail.com |
+-----------+----------+---------------+----------+---------------+--------+-------------+--------------------+
3 rows in set (0.06 sec)

mysql>